序号,股票代码,股票简称,公司名称,省份,城市,主营业务收入(201712),净利润(201712),员工人数,上市日期,招股书,公司财报,行业分类,产品类型,主营业务
2599,600593,大连圣亚,大连圣亚旅游控股股份有限公司,辽宁,大连市,34476.18,5545.98,630,2002-07-11,--,,景区,旅游服务,建设、经营水族馆、海洋探险人造景观、游乐园、海洋生物标本陈列馆、船舶模型陈列馆、餐饮、酒吧
2600,600594,益佰制药,贵州益佰制药股份有限公司,贵州,贵阳市,380766.18,38752.98,7011,2004-03-23,--,,中药生产,OTC、处方药、医疗服务,药品的生产和销售
序号,股票代码,股票简称,公司名称,省份,城市,主营业务收入(201712),净利润(201712),员工人数,上市日期,招股书,公司财报,行业分类,产品类型,主营业务
2601,600595,中孚实业,河南中孚实业股份有限公司,河南,郑州市,1152200.43,-18933.27,8915,2002-06-26,--,,铝,有色金属、电力、煤炭,铝加工产品的生产和销售、火力发电及煤炭的生产和销售。
2602,600596,新安股份,浙江新安化工集团股份有限公司,浙江,杭州市,727647.38,53273.54,5409,2001-09-06,--,,农药,农化产品、有机硅产品,农药化工、硅基新材料
2603,600597,光明乳业,光明乳业股份有限公司,上海,上海市,2167218.52,61723.96,5860,2002-08-28,--,,乳制品,乳制品制造业、牧业,生产、开发及销售乳制品和畜牧业业务
2604,600598,北大荒,黑龙江北大荒农业股份有限公司,黑龙江,哈尔滨市,299241.46,77998.53,34261,2002-03-29,--,,种植业,粮食作物、化肥、房地产开发,"土地发包经营;水稻、玉米等粮食作物的生产和销售;尿素的生产、销售;与种植业生产及农产品加工相关的技术、信息及服务体系的开发、咨询及运营;化肥零售(仅限分支机构经营),以及房地产开发与销售"
2605,600599,熊猫金控,熊猫金控股份有限公司,湖南,长沙市,34299.56,2005.68,258,2001-08-28,--,,其他非银行金融,烟花产品销售、金融理财产品,烟花的销售、互联网金融借贷平台、发放小额贷款
2606,600600,青岛啤酒,青岛啤酒股份有限公司,山东,青岛市,2627705.17,126301.72,40810,1993-08-27,--,,啤酒,啤酒,生产及销售啤酒
2607,600601,方正科技,方正科技集团股份有限公司,上海,上海市,509880.21,-82214.46,8009,1990-12-19,--,,PC、服务器及硬件,印刷电路板、软件系统集成、宽带服务、电脑及相关产品、定制开发、融合通信收入、与系统集成相关的服务、硬件产品销售、办公用品设备、软件产品销售、IDC业务、IT系统集成,"生产和销售PCB产品,网络宽带接入服务,IT系统集成及解决方案,PC产品的FA业务等。"
2608,600602,云赛智联,云赛智联股份有限公司,上海,上海市,420991.84,27749.16,2386,1990-12-19,--,,其他软件服务,制造业、商品贸易、物业租赁服务、系统集成及信息服务,基于物联网、云计算、大数据技术为基础的，面向城市智慧化领域的三大业务板块，即智能产品“基础”板块、云计大数据“平台”板块、行业解决方案“应用”板块
2609,600603,广汇物流,广汇物流股份有限公司,福建,厦门市,110065.87,34856.73,615,1992-01-13,--,,园区开发,物业租赁、商品房、保理业务,商贸物流业务
2610,600604,市北高新,上海市北高新股份有限公司,上海,上海市,219139.53,23147.51,178,1992-03-27,--,,园区开发,房地产、租赁和其他服务,产业地产开发运营、产业投资孵化、产业服务集成
2611,600605,汇通能源,上海汇通能源股份有限公司,上海,上海市,247349.37,2937.53,85,1992-03-27,--,,贸易,贸易、风力发电、房产租赁、物业管理,风力发电、有色金属（铜）贸易及房产租赁
2612,600606,绿地控股,绿地控股集团股份有限公司,上海,上海市,29017415.2,903776.65,33473,1992-03-27,--,,房地产开发,房地产、基建、金融、绿地全球商品直销中心、酒店旅游、汽车服务、能源,房地产开发、基础设施配套建设、金融信息服务、绿化工程、能源、汽车销售、酒店管理、物业管理等业务。
2613,600608,ST沪科,上海宽频科技股份有限公司,上海,上海市,47008.63,6232.12,272,1992-03-27,--,,特钢,钢材制品加工、商品贸易,高新技术产业投资，实业投资，投资管理，通信网络设备、计算机信息工程、集成电路设计与销售、智能社区网络、异型钢管等。
2614,600609,金杯汽车,金杯汽车股份有限公司,辽宁,沈阳市,577054.6,10071.3,3953,1992-07-24,--,,汽车零部件,整车、零部件及材料,汽车及零部件制造
2615,600610,*ST毅达,上海中毅达股份有限公司,上海,上海市,3052.14,-112855.8,450,1992-08-05,--,,园林工程,道路施工、园林绿化,园林工程及销售苗木业务
2616,600611,大众交通,大众交通(集团)股份有限公司,上海,上海市,239429.64,87260.23,10899,1992-08-07,--,,公交,工商业、房地产业、旅游饮食服务业、交通运输业,城市综合交通服务等产业及房地产业、金融及股权投资产业
2617,600612,老凤祥,老凤祥股份有限公司,上海,上海市,3981035.44,113619.6,2517,1992-08-14,--,,珠宝首饰,笔类、珠宝首饰、黄金交易、工艺品销售、商贸,生产经营金银制品、珠宝、钻石与相关产品及设备，工艺美术品、旅游工艺品与相关产品及原料，文教用品
2618,600613,神奇制药,上海神奇制药投资管理股份有限公司,上海,上海市,173571.6,12960.13,1783,1992-08-20,--,,中药生产,中成药、化学药、医药商业,药品的研发、生产与销售
2619,600614,鹏起科技,鹏起科技发展股份有限公司,上海,上海市,200367.18,38716.95,1106,1992-08-28,--,,有色金属加工,军工业务、环保业务、房地产业务,环保、军工、房地产、橡胶、农机等业务
2620,600615,丰华股份,上海丰华(集团)股份有限公司,上海,上海市,9450.61,10602.21,189,1992-09-10,--,,金属制品,镁合金类产品、铝合金类产品,金属制品
序号,股票代码,股票简称,公司名称,省份,城市,主营业务收入(201712),净利润(201712),员工人数,上市日期,招股书,公司财报,行业分类,产品类型,主营业务
2621,600616,金枫酒业,上海金枫酒业股份有限公司,上海,上海市,98693.34,5518.46,1196,1992-09-29,--,,黄酒,黄酒,黄酒生产经营
2622,600617,国新能源,山西省国新能源股份有限公司,山西,太原市,965116.21,1658.73,5279,1992-10-13,--,,燃气,天然气及煤层气、电力,天然气输气管道建设、生产、经营管理及对外专营、天然气储运、配送与销售等
2623,600618,氯碱化工,上海氯碱化工股份有限公司,上海,上海市,722674.61,99260.33,790,1992-11-13,--,,氯碱,烧碱、氯及氯制品、聚氯乙烯塑料树脂,碱和氯等化工原料及产品。
2624,600619,海立股份,上海海立(集团)股份有限公司,上海,上海市,1044677.54,28123.09,5476,1992-11-16,--,,制冷空调设备,压缩机及相关制冷设备、电机,压缩机及相关制冷设备的销售、贸易及房产租赁业务。
2625,600620,天宸股份,上海市天宸股份有限公司,上海,上海市,5120.79,6254.96,526,1992-11-17,--,,公交,出租车经营、物业租赁、物业管理,出租车业务、物业管理及物业租赁
2626,600621,华鑫股份,上海华鑫股份有限公司,上海,上海市,222564.77,77459.31,1615,1992-12-02,--,,证券,运输、房地产,证券业务
2627,600622,光大嘉宝,光大嘉宝股份有限公司,上海,上海市,308330.66,54535.79,462,1992-12-03,--,,房地产开发,房地产开发、不动产资管,房地产开发业务
2628,600623,华谊集团,上海华谊集团股份有限公司,上海,上海市,4355329.29,61912.84,13149,1992-12-04,--,,其他化学原料,轮胎行业、化工制造、化工服务,能源化工、绿色轮胎、先进材料、精细化工和化工服务
2629,600624,复旦复华,上海复旦复华科技股份有限公司,上海,上海市,73572.92,4247.5,1522,1993-01-05,--,,综合,工业、软件开发业,软件开发、生物医药、科技园区产业
2630,600626,申达股份,上海申达股份有限公司,上海,上海市,1112599.88,19336.26,9673,1993-01-07,--,,纺织,汽车内饰及声学元件产品、纺织新材料产品、进出口贸易,包括以纺织品为主的外贸业务、纺织新材料业务、汽车内饰业务、房产物业业务等
2631,600628,新世界,上海新世界股份有限公司,上海,上海市,302249.06,44829.51,1069,1993-01-19,--,,百货,百货商场、医药销售、酒店服务业,百货零售
2632,600629,华建集团,华东建筑集团股份有限公司,上海,上海市,528974.5,25641.12,6292,1993-02-09,--,,专业工程,工程设计、工程承包、工程技术管理及勘察、信息化服务及销售,建筑工程设计、水利工程设计、历史建筑保护和利用设计、环境与装饰设计、市政工程设计、建筑声学设计、项目管理、工程承包、工程监理、项目可行性研究、投资控制、科技咨询等。
2633,600630,龙头股份,上海龙头(集团)股份有限公司,上海,上海市,442191.04,12850.67,1949,1993-02-09,--,,其他服装,针织面料、针织服装、童装内衣、家纺原料、床上用品、毛巾、服装服饰、外贸、物业租赁,品牌销售与国际贸易
2634,600633,浙数文化,浙报数字文化集团股份有限公司,浙江,杭州市,162662.06,165693.64,1782,1993-03-04,--,,营销服务,报刊发行业务、广告及网络推广业务、印刷业务、无线增值服务业务、在线游戏运营业务、平台运营业务、信息服务业务、商品销售业务,聚焦数字娱乐、数字体育、大数据等三大产业板块，全面发展基于互联网的数字文化产业。
2635,600634,*ST富控,上海富控互动娱乐股份有限公司,上海,上海市,80556.59,4589.8,466,1993-03-04,--,,游戏,游戏、租赁,游戏研发和运营。
2636,600635,大众公用,上海大众公用事业(集团)股份有限公司,上海,上海市,460210.82,47413.34,2174,1993-03-04,--,,燃气,商业、施工业、市政隧道运营、燃气销售、污水处理业、金融,主要投资经营城市燃气、城市交通、环境市政、金融创投四大板块
2637,600636,三爱富,上海三爱富新材料股份有限公司,上海,上海市,524337.01,4780.72,2988,1993-03-16,--,,氟化工,含氟聚合物、CFC替代品、CFC产品,文化教育及氟化工
2638,600637,东方明珠,东方明珠新媒体股份有限公司,上海,上海市,1626115.95,223691.12,5500,1993-03-16,--,,有线电视,影视互娱、媒体网络、视频购物、文旅消费,专门从事IPTV、互联网电视、手机电视等新媒体业务运营
2639,600638,新黄浦,上海新黄浦置业股份有限公司,上海,上海市,177759.04,64497.68,510,1993-03-26,--,,房地产开发,房地产业、服务业,房地产开发与销售
2640,600639,浦东金桥,上海金桥出口加工区开发股份有限公司,上海,上海市,167382.58,73745.7,337,1993-03-26,--,,园区开发,房地产经营、酒店公寓服务,房地产租赁、房地产销售和服务式公寓租赁
序号,股票代码,股票简称,公司名称,省份,城市,主营业务收入(201712),净利润(201712),员工人数,上市日期,招股书,公司财报,行业分类,产品类型,主营业务
2641,600640,号百控股,号百控股股份有限公司,上海,上海市,556562.2,25125.91,3293,1993-04-07,--,,旅游服务,互联网文娱、积分兑换、电子商务、宾馆酒店业,商旅预订及酒店经营和管理
2642,600641,万业企业,上海万业企业股份有限公司,上海,上海市,209626.19,169890.6,371,1993-04-07,--,,房地产开发,房产销售、贸易、租赁、物业服务,房地产开发与销售
2643,600642,申能股份,申能股份有限公司,上海,上海市,3240402.16,173763.9,2506,1993-04-16,--,,电力,电力行业、石油天然气行业、燃煤销售行业,电力、石油天然气的开发建设和经营管理
2644,600643,爱建集团,上海爱建集团股份有限公司,上海,上海市,67069.8,82977.22,498,1993-04-26,--,,其他非银行金融,商业、融资租赁业,实业投资，投资管理，进出口业务，商务咨询
2645,600644,乐山电力,乐山电力股份有限公司,四川,乐山市,205891.26,4285.63,3397,1993-04-26,--,,水电,电力业务、天然气业务、自来水业务,电力、天然气、自来水、宾馆等四大业务
2646,600645,中源协和,中源协和细胞基因工程股份有限公司,天津,天津市,87091.35,-1845.95,1981,1993-05-04,--,,生物医药,科研服务业、化妆品制造业、检测试剂制造业,生命科学技术开发和干细胞基因工程产业化
2647,600647,同达创业,上海同达创业投资股份有限公司,上海,上海市,2368.67,1113.87,45,1993-05-04,--,,贸易,房地产、商品销售,高新技术产业投资，实业投资及资产管理，农业开发经营与国内贸易，食品及饮料的生产和销售
2648,600648,外高桥,上海外高桥集团股份有限公司,上海,上海市,895356.74,73963.61,3436,1993-05-04,--,,园区开发,房地产租赁、房地产转让、商品销售、进出口代理、物流、制造业、服务业,园区开发、商业地产和物流贸易
2649,600649,城投控股,上海城投控股股份有限公司,上海,上海市,321516.41,175859.43,265,1993-05-18,--,,房地产开发,房产业务、环保业务、承包及设计规划收入、BOT利息收入,环境、地产、投资等业务
2650,600650,锦江投资,上海锦江国际实业投资股份有限公司,上海,上海市,236874.59,24746.24,9970,1993-06-07,--,,公交,车辆营运、汽车销售、低温物流,交通运输、仓储行业，经营车辆营运、物流仓储等相关业务
2651,600651,飞乐音响,上海飞乐音响股份有限公司,上海,上海市,544484.56,5523.91,5166,1990-12-19,--,,照明设备,HID光源、节能系列、电感电子、传统灯具、LED产品、汽车照明、零部件、特种光源、音响类产品的销售及工程服务、照明设备安装工程、合同能源管理、设计及技术服务,"工程项目和整体照明解决方案,为客户提供专业方案、设计优化、工程施工等一揽子服务"
2652,600652,游久游戏,上海游久游戏股份有限公司,上海,上海市,17655.42,-42231.46,256,1990-12-19,--,,游戏,网络游戏,网络游戏
2653,600653,申华控股,上海申华控股股份有限公司,上海,上海市,580247.47,-57079.42,3142,1990-12-19,--,,汽车销售,商业、房地产、新能源,汽车消费服务类业务、新能源业务、少量房地产业务及类金融板块。
2654,600654,ST中安,中安科股份有限公司,上海,上海市,296916.47,-73503.08,11205,1990-12-19,--,,行业应用软件,安防系统集成、安保运营服务、安保智能产品制造、房屋租赁,安防消防系统集成、产品制造、综合运营服务业务
2655,600655,豫园股份,上海豫园旅游商城股份有限公司,上海,上海市,1711124.68,70024.18,3935,1992-09-02,--,,珠宝首饰,黄金珠宝饰品、文化商业及旅游地产、海派餐饮、中医药,黄金珠宝、进出口、百货的零售与批发。
2656,600657,信达地产,信达地产股份有限公司,北京,北京市,1521604.89,101128.77,2342,1993-05-24,--,,房地产开发,住宅、商业、车位其他房地产产品、物业管理,以房地产开发业务为核心，以房地产金融业务、持有型物业经营和物业服务为支持
2657,600658,电子城,北京电子城投资开发集团股份有限公司,北京,北京市,213397.46,50849.07,417,1993-05-24,--,,园区开发,地产销售、园区地产出租、物业管理、文化传媒,房地产开发与经营业
2658,600660,福耀玻璃,福耀玻璃工业集团股份有限公司,福建,福州市,1871560.88,314874.8,27713,1993-06-10,--,,汽车零部件,汽车级浮法玻璃、汽车玻璃、机车玻璃,汽车级浮法玻璃、汽车玻璃的设计、生产、销售及服务
2659,600661,新南洋,上海新南洋昂立教育科技股份有限公司,上海,上海市,172356.16,12311.58,5048,1993-06-14,--,,在线教育,教育服务、精密制造、数字电视与信息服务,教育业务
2660,600662,强生控股,上海强生控股股份有限公司,上海,上海市,407755.98,10094.17,25880,1993-06-14,--,,出租车,出租汽车、汽车租赁、汽车服务、旅游服务、房产,汽车出租、汽车修理、汽车销售、房地产开发、旅游服务等业务。
序号,股票代码,股票简称,公司名称,省份,城市,主营业务收入(201712),净利润(201712),员工人数,上市日期,招股书,公司财报,行业分类,产品类型,主营业务
2661,600663,陆家嘴,上海陆家嘴金融贸易区开发股份有限公司,上海,上海市,932459.38,312991.77,4704,1993-06-28,--,,园区开发,房产销售、动迁房转让、房地产租赁、酒店、物业管理、金融业,"以城市综合开发为主的房地产综合开发业务,包括土地批租、房产销售、房地产租赁、酒店、物业管理等"
2662,600664,哈药股份,哈药集团股份有限公司,黑龙江,哈尔滨市,1201753.13,40697.59,15709,1993-06-29,--,,化学制剂,医药产品,医药产品的生产和销售
2663,600665,天地源,天地源股份有限公司,上海,上海市,395470.91,25408.11,1725,1993-07-09,--,,房地产开发,房地产、物业,房地产开发和经营、自有房屋租赁，物业管理，实业投资、资产管理，国内贸易（除专项规定），与经营相关的咨询业务。
2664,600666,奥瑞德,奥瑞德光电股份有限公司,重庆,重庆市,118994.24,5505.49,1728,1993-07-12,--,,电子零部件,研磨（抛光）系列设备、蓝宝石晶棒、单晶炉、3D玻璃热弯机、精雕机,蓝宝石晶体材料、蓝宝石晶体生长专用装备及蓝宝石制品的研发、生产和销售;硬脆材料精密加工专用设备的研发、设计、生产和销售
2665,600667,太极实业,无锡市太极实业股份有限公司,江苏,无锡市,1203381.94,41779.0,7845,1993-07-28,--,,集成电路,半导体、工程技术服务、光伏电站投资运营业务和涤纶化纤,半导体业务、工程技术服务业务、光伏电站投资运营业务和涤纶化纤业务
2666,600668,尖峰集团,浙江尖峰集团股份有限公司,浙江,金华市,282656.72,34849.43,1683,1993-07-28,--,,水泥,水泥、医药工业产品、医药商业产品、健康品,以水泥和医药业务为主，以国际贸易、电缆等业务为辅
2667,600671,天目药业,杭州天目山药业股份有限公司,浙江,杭州市,17638.28,814.16,542,1993-08-23,--,,中药生产,药品、保健品,药品及相关保健品的销售
2668,600673,东阳光科,广东东阳光科技控股股份有限公司,广东,韶关市,741190.35,52306.58,6767,1993-09-17,--,,铝,电极箔、电容器、磁性材料、电子光箔、空调箔、板带材、钎焊箔、化工产品、包装印刷等,研发、生产和销售电子材料
2669,600674,川投能源,四川川投能源股份有限公司,四川,成都市,79959.9,326473.53,844,1993-09-24,--,,水电,电力、工业自动化控制设备,以清洁能源为主业，并投资经营信息化等高新技术产业。
2670,600675,中华企业,中华企业股份有限公司,上海,上海市,765897.03,36677.23,1568,1993-09-24,--,,房地产开发,房地产开发经营,房地产投资开发、商品房经营、租赁及物业管理
2671,600676,交运股份,上海交运集团股份有限公司,上海,上海市,931505.25,44599.24,6066,1993-09-28,--,,公路运输,道路货运与物流服务、道路客运与旅游服务、汽车零部件制造与销售服务、乘用车销售与汽车后服务,运输与物流服务业、汽车零部件制造与汽车后服务业、水上旅游服务业
2672,600677,航天通信,航天通信控股集团股份有限公司,浙江,杭州市,1019558.56,10026.51,7029,1993-09-28,--,,通信终端设备,通信产业、航天防务,轻纺产品生产、销售，进出口贸易，手机销售，计算机软件开发、销售，通信终端设施的维护、通信增值服务、航天防务等
2673,600678,四川金顶,四川金顶(集团)股份有限公司,四川,乐山市,18496.45,2894.08,191,1993-10-08,--,,石灰石,石灰石、氧化钙,非金属矿开采、加工及产品销售
2674,600679,上海凤凰,上海凤凰企业(集团)股份有限公司,上海,上海市,142808.14,7682.41,879,1993-10-08,--,,自行车,自行车、辐条,自行车制造、房地产开发与经营，城市和绿化建设，旧区改造，商业开发，市政基础设施建设，物业、仓储、物流经营管理
2675,600680,*ST上普,上海普天邮通科技股份有限公司,上海,上海市,64030.94,-35012.77,639,1993-10-18,--,,轨道交通设备,网络系统、AFC、金融机具与运维服务、能源集成,轨道交通、商业自动化、能源集成和通信安防
2676,600681,百川能源,百川能源股份有限公司,湖北,武汉市,297230.01,85803.8,2180,1993-10-18,--,,燃气,天然气、燃气接驳、燃气具、供热、燃气运输,"城镇燃气销售配送、燃气接驳、燃气用具销售以及维修、维护等,具体包括燃气销售、燃气接驳及燃气具销售。"
2677,600682,南京新百,南京新街口百货商店股份有限公司,江苏,南京市,1796035.54,73623.22,16333,1993-10-18,--,,百货,商业、房地产业、宾馆餐饮业、健康养老行业、健康护理行业、专业技术服务业、科研服务业,以百货为主的零售连锁经营业态
2678,600683,京投发展,京投发展股份有限公司,浙江,宁波市,621739.6,32174.7,615,1993-10-25,--,,房地产开发,房产销售、物业租赁、进出口贸易、国内贸易、旅游饮食服务,房地产开发、经营及租赁
2679,600684,珠江实业,广州珠江实业开发股份有限公司,广东,广州市,423985.41,35978.32,1081,1993-10-28,--,,房地产开发,珠江璟园、珠江花城、珠江郦城、珠江嘉园、御东雅苑、创基丽江国际花园、中侨中心、三亚金水湾、金盛大厦、物业出租及管理、健康管理咨询,房地产及物业管理。
2680,600685,中船防务,中船海洋与防务装备股份有限公司,广东,广州市,2231338.19,8779.66,15810,1993-10-28,--,,船舶制造,造船业务、海工业务、修船业务、钢结构工程、机电产品,船舶及其辅机、承包境外机电工程和境内国际招标工程
序号,股票代码,股票简称,公司名称,省份,城市,主营业务收入(201712),净利润(201712),员工人数,上市日期,招股书,公司财报,行业分类,产品类型,主营业务
2681,600686,金龙汽车,厦门金龙汽车集团股份有限公司,福建,厦门市,1773608.4,47886.52,14373,1993-11-08,--,,商用车,汽车及车身件,客车产品的生产和销售
2682,600687,刚泰控股,甘肃刚泰控股(集团)股份有限公司,甘肃,兰州市,821752.6,54515.31,1251,1993-11-08,--,,黄金,黄金及黄金饰品珠宝业、影视文化娱乐,矿业资源开发利用、贵金属制品设计和销售、勘探技术服务、贸易和股权投资。
2683,600688,上海石化,中国石化上海石油化工股份有限公司,上海,上海市,9201356.9,614155.8,9939,1993-11-08,--,,石油加工,石油化工产品,石油化工业务
2684,600689,上海三毛,上海三毛企业(集团)股份有限公司,上海,上海市,127746.12,2070.27,1069,1993-11-08,--,,毛纺,工业、商业、保安服务,纺织产品及业务咨询。
2685,600690,青岛海尔,青岛海尔股份有限公司,山东,青岛市,15925446.69,692579.23,76896,1993-11-19,--,,冰箱、洗衣机、空调,空调、电冰箱、厨卫、洗衣机、装备部品、渠道综合服务业务,从事电冰箱、空调器、电冰柜、洗衣机、热水器、洗碗机、燃气灶等家电及其相关产品生产经营研发，以及商业流通业务。
2686,600691,阳煤化工,阳煤化工股份有限公司,--,--,2026169.29,11613.83,17973,1993-11-19,--,,--,煤化工产品、化工设备,"化工产品、化肥产品等的生产和销售,发电及供热业务,化工机械设备制造,化工产品研发"
2687,600692,亚通股份,上海亚通股份有限公司,上海,上海市,121383.6,6389.09,662,1993-11-19,--,,贸易,交通运输业务、商品销售业务、工程业务、广告、咨询业务、农业、旅游业务、房产销售,"公司资产置换后,尚未确定主营业务。公司拥有2500多亩的农业土地使用权,目前用于出租。"
2688,600693,东百集团,福建东百集团股份有限公司,福建,福州市,385569.57,24741.22,1082,1993-11-22,--,,百货,房地产销售、百货零售、供应链贸易、房产租赁、物业管理、酒店餐饮,以百货零售为主业，同时经营商业地产开发和房产租赁，辅以物业管理、酒店餐饮和广告信息。
2689,600694,大商股份,大商股份有限公司,辽宁,大连市,2674351.37,87655.63,17960,1993-11-22,--,,百货,百货、超市、家电连锁,商品零售。
2690,600695,绿庭投资,上海绿庭投资控股集团股份有限公司,上海,上海市,5006.81,4763.88,68,1993-11-22,--,,其他非银行金融,投资管理,投资管理和资产管理
2691,600696,ST岩石,上海岩石企业发展股份有限公司,上海,上海市,17508.93,1803.47,20,1993-12-06,--,,房地产开发,贸易、房屋租赁、融资租赁、商业保理、房产销售,房地产综合开发、商品房销售、商场物业出租及相应物业管理
2692,600697,欧亚集团,长春欧亚集团股份有限公司,吉林,长春市,1398142.4,30518.26,9444,1993-12-06,--,,百货,商品流通、房地产、租赁服务、物业租赁、旅游餐饮业,综合百货业务
