序号,股票代码,股票简称,公司名称,省份,城市,主营业务收入(201712),净利润(201712),员工人数,上市日期,招股书,公司财报,行业分类,产品类型,主营业务
1669,300290,荣科科技,荣科科技股份有限公司,辽宁,沈阳市,41865.77,1882.01,514,2012-02-16,--,,其他软件服务,健康数据服务、智能融合云服务,数据中心集成建设与运营维护的第三方服务(以下简称数据中心第三方服务)、重点行业信息化解决方案以及金融IT外包服务。
1670,300291,华录百纳,北京华录百纳影视股份有限公司,北京,北京市,224762.37,11019.85,304,2012-02-09,--,,影视,影视、综艺、体育、营销,影视剧和经纪业务
1671,300292,吴通控股,吴通控股集团股份有限公司,江苏,苏州市,255846.51,22559.58,1261,2012-02-29,--,,通信传输设备,无线通信射频连接系统、天线、光纤接入产品、同轴电缆、移动终端产品、信息服务、数字营销服务业务,通信连接系统、移动通讯终端产品、企业移动信息化服务和数字营销服务
1672,300293,蓝英装备,沈阳蓝英工业自动化装备股份有限公司,辽宁,沈阳市,134862.5,718.95,1187,2012-03-08,--,,智能装备,数字化工厂、工业清洗系统及表面处理、橡胶智能装备、电气自动化及集成,数字化工厂、电气自动化及集成、橡胶智能装备、精密机械、智慧城市
1673,300294,博雅生物,博雅生物制药集团股份有限公司,江西,抚州市,146052.19,35658.85,1629,2012-03-08,--,,生物医药,血液制品、糖尿病用药、生化类用药、医药经销,血液制品的研发、生产和销售
1674,300295,三六五网,江苏三六五网络股份有限公司,江苏,南京市,40778.06,9411.29,1153,2012-03-15,--,,房地产服务,房地产网络营销服务、研究咨询及其他服务、互联网金融平台服务业务,服务于房地产家居业
1675,300296,利亚德,利亚德光电股份有限公司,北京,北京市,647080.33,120978.15,4292,2012-03-15,--,,显示器件,LED、夜游经济业务、文旅新业态业务、VR体验业务,电子显示产品、照明产品、电子标识产品的生产和销售。
1676,300297,蓝盾股份,蓝盾信息安全技术股份有限公司,广东,广州市,221647.64,41380.95,2798,2012-03-15,--,,其他软件服务,安全产品、安全集成、安全服务、电磁安防产品、电磁安防工程、电磁安防服务、系统服务、电商运营服务,安全产品的研发、生产及销售、安全集成、安全服务、安全运营。
1677,300298,三诺生物,三诺生物传感股份有限公司,湖南,长沙市,103300.77,25797.19,1855,2012-03-19,--,,医疗器械,微量血快速血糖监测系统、相关指标POCT检测系统,主要从事血糖监测系统的生产和销售
1678,300299,富春股份,富春科技股份有限公司,福建,福州市,53034.63,-17129.2,695,2012-03-19,--,,通信配套服务,通信技术服务、集成设备销售、游戏业务,为通信运营商等通信信息化建设单位提供独立第三方通信网络建设技术服务
1679,300300,汉鼎宇佑,汉鼎宇佑互联网股份有限公司,浙江,杭州市,40438.54,8514.05,452,2012-03-19,--,,行业应用软件,信息技术服务,建筑智能化、公共安全管理智能化
1680,300301,长方集团,深圳市长方集团股份有限公司,广东,深圳市,175040.75,3623.84,5183,2012-03-21,--,,LED,LED照明光源器件、LED照明产品,从事LED照明光源器件和LED照明产品的研发、设计、生产和销售
序号,股票代码,股票简称,公司名称,省份,城市,主营业务收入(201712),净利润(201712),员工人数,上市日期,招股书,公司财报,行业分类,产品类型,主营业务
1681,300302,同有科技,北京同有飞骥科技股份有限公司,北京,北京市,37961.55,5082.66,278,2012-03-21,--,,专用计算机设备,软件、信息技术,数据存储、数据保护、容灾等技术的研究、开发和应用
1682,300303,聚飞光电,深圳市聚飞光电股份有限公司,广东,深圳市,205513.97,5984.78,2173,2012-03-19,--,,LED,LED、通讯技术服务,SMDLED产品的研发、生产与销售
1683,300304,云意电气,江苏云意电气股份有限公司,江苏,徐州市,64162.07,14125.72,672,2012-03-21,--,,汽车零部件,汽车电子产品,车用智能电源控制器等汽车电子产品的研发、生产和销售
1684,300305,裕兴股份,江苏裕兴薄膜科技股份有限公司,江苏,常州市,59051.62,6895.82,319,2012-03-29,--,,塑料制品,塑料聚酯薄膜,中厚型特种聚酯薄膜的研发、生产与销售。
1685,300306,远方信息,杭州远方光电信息股份有限公司,浙江,杭州市,55761.28,12834.93,1127,2012-03-29,--,,仪器仪表,智能检测信息系统、检测信息服务,从事检测信息设备的研发、生产和销售以及提供综合检测解决方案
1686,300307,慈星股份,宁波慈星股份有限公司,浙江,宁波市,140437.51,23871.55,2106,2012-03-29,--,,纺织服装机械,针织机械、机器人,电脑针织机械的研发、生产和销售
1687,300308,中际旭创,中际旭创股份有限公司,山东,烟台市,235708.35,16150.54,2265,2012-04-10,--,,电机,10G/25G光模块、40G/100G光模块、单/多工序机、自动生产线、重要零部件,电机定子绕组制造装备的研发、设计、制造、销售及服务
1688,300309,吉艾科技,吉艾科技集团股份公司,北京,北京市,74632.85,21226.47,287,2012-04-10,--,,油田服务,石油仪器、石油工程服务、石油炼化、AMC业务,石油设备研发、制造；石油钻井、测井、定向井等工程服务；石油炼化业务；特殊机会资产的管理、评估、收购、处置及困境企业重整服务、债转股服务等业务
1689,300310,宜通世纪,广东宜通世纪科技股份有限公司,广东,广州市,258246.33,23132.62,7291,2012-04-25,--,,通信配套服务,通信服务、通信网络设备,通信网络工程服务、通信网络维护服务、通信网络优化服务和系统解决方案业务
1690,300311,任子行,任子行网络技术股份有限公司,广东,深圳市,107690.81,14926.81,1627,2012-04-25,--,,基础软件,专用安全审计产品、通用安全审计产品、网络监管产品及安全集成、通信产品、网络游戏运营-麻将类游戏、网络游戏运营-牌类游戏,网络内容与行为审计和监管产品的研发、生产、销售和提供安全集成及安全审计相关服务。
1691,300312,邦讯技术,邦讯技术股份有限公司,北京,北京市,30990.0,-14181.28,782,2012-05-08,--,,通信配套服务,无线网络优化设备的销售及系统集成、互联网游戏,通讯业务和互联网游戏业务
1692,300313,天山生物,新疆天山畜牧生物工程股份有限公司,新疆,昌吉回族自治州,19530.57,744.43,247,2012-04-25,--,,畜牧养殖,自产种公牛冻精、胚胎,从事牛、羊的品种改良业务
1693,300314,戴维医疗,宁波戴维医疗器械股份有限公司,浙江,宁波市,30390.54,4703.32,573,2012-05-08,--,,医疗器械,医疗器械制造,从事医疗器械产品的研发、生产和销售
1694,300315,掌趣科技,北京掌趣科技股份有限公司,北京,北京市,176821.45,26389.44,1668,2012-05-11,--,,游戏,移动终端游戏、互联网页面游戏,第二类增值电信业务中的信息服务业务
1695,300316,晶盛机电,浙江晶盛机电股份有限公司,浙江,绍兴市,194884.82,38664.25,1772,2012-05-11,--,,太阳能,晶体硅生长设备、智能化加工设备、蓝宝石材料,从事晶体生长设备研发、制造、销售
1696,300317,珈伟股份,深圳珈伟光伏照明股份有限公司,广东,深圳市,343711.86,31482.03,1958,2012-05-11,--,,LED,LED照明、光伏照明、EPC光伏电站工程、光伏发电、锂电池,太阳能光伏照明产品、高效LED光源、太阳能消费类电子产品的研发、生产及销售；提供各种LED照明光源的整体解决方案。
1697,300318,博晖创新,北京博晖创新生物技术股份有限公司,北京,北京市,44375.44,3885.1,1228,2012-05-23,--,,医疗器械,仪器及软件、试剂、白蛋白,主要从事临床医疗检测系统（含检测仪器、检测软件、检测试剂、校准品、质控品、国家标准物质、试剂卡、参考品等）的研究、开发、生产和销售
1698,300319,麦捷科技,深圳市麦捷微电子科技股份有限公司,广东,深圳市,144133.69,-35119.86,3301,2012-05-23,--,,电子元件,电子制造业,电子产品生产加工和销售。
1699,300320,海达股份,江阴海达橡塑股份有限公司,江苏,无锡市,129165.29,14028.01,1505,2012-06-01,--,,其他橡胶制品,橡胶和塑料部件,橡胶制品、塑料制品、金属制品、通用设备、专用设备的制造、加工。
1700,300321,同大股份,山东同大海岛新材料股份有限公司,山东,潍坊市,43675.06,2448.47,651,2012-05-23,--,,纺织面料,超纤基布、超纤绒面革、超纤光面革,生产销售：超纤基布、超纤光面革、超纤绒面革、服装面料及辅料（不含棉纺）等。
序号,股票代码,股票简称,公司名称,省份,城市,主营业务收入(201712),净利润(201712),员工人数,上市日期,招股书,公司财报,行业分类,产品类型,主营业务
1701,300322,硕贝德,惠州硕贝德无线科技股份有限公司,广东,惠州市,206764.44,5777.98,1792,2012-06-08,--,,电子零部件,无线通信终端天线、通信产品配件,无线通信终端天线的研发、生产及销售
1702,300323,华灿光电,华灿光电股份有限公司,湖北,武汉市,262990.34,50210.64,6737,2012-06-01,--,,LED,LED蓝光芯片、LED绿光芯片、衬底片,生产、销售高亮度LED芯片
1703,300324,旋极信息,北京旋极信息技术股份有限公司,北京,北京市,329714.08,38929.22,4726,2012-06-08,--,,其他软件服务,嵌入式系统及元器件测试业务、信息安全业务、能源信息化业务、智慧建筑业务、智慧交通业务,嵌入式产品的开发、生产、销售和服务业务
1704,300325,德威新材,江苏德威新材料股份有限公司,江苏,苏州市,178744.16,2508.16,722,2012-06-01,--,,塑料制品,XLPE料、通用PVC料、内外屏蔽料、汽车线束料、弹性体料、UL系列料,线缆用高分子材料的研发、生产和销售
1705,300326,凯利泰,上海凯利泰医疗科技股份有限公司,上海,上海市,80226.68,19498.14,851,2012-06-13,--,,医疗器械,椎体成形微创介入手术系统、骨科植入物、骨科手术器械、药物洗脱冠脉支架、股权投资业务,椎体成形微创介入手术系统的研发、生产和销售
1706,300327,中颖电子,中颖电子股份有限公司,上海,上海市,68572.48,13363.77,314,2012-06-13,--,,集成电路,集成电路设计,集成电路产品的设计和销售，以及相关的售后服务及技术服务
1707,300328,宜安科技,东莞宜安科技股份有限公司,广东,东莞市,81073.44,3276.16,2030,2012-06-19,--,,铝,铝合金、镁合金等精密压铸件,新材料研发、设计、生产、销售
1708,300329,海伦钢琴,海伦钢琴股份有限公司,浙江,宁波市,46965.78,4098.05,1225,2012-06-19,--,,钢琴,西乐器制造,钢琴的研发、制造、销售与服务，艺术教育培训产业以及电商业务等
1709,300330,华虹计通,上海华虹计通智能系统股份有限公司,上海,上海市,22372.99,594.91,191,2012-06-19,--,,其他软件服务,AFC项目、智慧城市项目,非接触式IC卡自动收费系统的设计、开发、集成、销售和服务及相关终端产品的生产和销售
1710,300331,苏大维格,苏州苏大维格科技集团股份有限公司,江苏,苏州市,94411.77,8124.43,1655,2012-06-28,--,,显示器件,微纳光学产品、设备、技术服务,微纳光学产品的研发、制造与技术服务
1711,300332,天壕环境,天壕环境股份有限公司,北京,北京市,198387.75,9017.23,1711,2012-06-28,--,,电力,燃气供应及安装、合同能源管理、工程建设承包与技术服务、水处理工程服务、膜产品销售,以合同能源管理模式从事余热发电项目的连锁投资、研发设计、工程建设和运营管理
1712,300333,兆日科技,深圳兆日科技股份有限公司,广东,深圳市,23109.97,1894.43,267,2012-06-28,--,,行业应用软件,电子支付密码系统、纸纹防伪系统,各类票据防伪产品的研发、生产及销售
1713,300334,津膜科技,天津膜天膜科技股份有限公司,天津,天津市,63311.73,-6656.74,573,2012-07-05,--,,污水处理工程,专用设备制造,生产、销售中空纤维膜、膜组件、膜分离设备、水处理设备及相关产品；提供水处理工程的设计及项目管理和相关的技术与管理服务；从事环保工程专业承包业务及提供环境污染治理设施运营管理服务。
1714,300335,迪森股份,广州迪森热能技术股份有限公司,广东,广州市,192071.47,21302.22,1375,2012-07-10,--,,电力,清洁能源综合服务-B端运营、清洁能源综合服务-C端产品与服务,利用生物质燃料等新型清洁能源，为客户提供热能运营服务
1715,300336,新文化,上海新文化传媒集团股份有限公司,上海,上海市,123321.61,24638.65,341,2012-07-10,--,,影视,影视内容、户外LED大屏,影视剧的投资、制作、发行及衍生业务
1716,300337,银邦股份,银邦金属复合材料股份有限公司,江苏,无锡市,198910.26,783.73,984,2012-07-18,--,,铝,钎焊用铝合金复合板带箔、铝钢复合带材、钎焊用铝合金板带箔,从事钎焊用铝合金复合板带箔、铝钢复合带材、钎焊用铝合金板带箔等产品的研发、生产、销售
1717,300338,开元股份,长沙开元仪器股份有限公司,湖南,长沙市,98074.0,16008.04,4533,2012-07-26,--,,在线教育,仪器仪表、职业教育,教育培训服务；煤质检测仪器设备的研发、生产、销售和服务
1718,300339,润和软件,江苏润和软件股份有限公司,江苏,南京市,161197.44,24941.12,6889,2012-07-18,--,,行业应用软件,软件业务、系统集成及运维服务业务、智能终端产品业务、外购软硬件产品销售业务,向国际国内客户提供软件产品及软件服务、智能终端产品、系统集成服务等软件和信息技术服务业务。
1719,300340,科恒股份,江门市科恒实业股份有限公司,广东,江门市,206059.97,12240.1,1345,2012-07-26,--,,电池,锂离子电池正极材料、锂离子电池自动化生产设备,高性能稀土发光材料、锂电材料的研发、生产和销售
1720,300341,麦迪电气,麦克奥迪(厦门)电气股份有限公司,福建,厦门市,79553.42,13032.42,1861,2012-07-26,--,,输配电设备,输配电设备、显微镜,研制、开发、生产和销售输变电行业相配套的绝缘制品及其它相关部件
序号,股票代码,股票简称,公司名称,省份,城市,主营业务收入(201712),净利润(201712),员工人数,上市日期,招股书,公司财报,行业分类,产品类型,主营业务
1721,300342,天银机电,常熟市天银机电股份有限公司,江苏,苏州市,77297.37,19056.99,1097,2012-07-26,--,,压缩机,家电零配件、军工电子,冰箱压缩机用配套产品
1722,300343,联创互联,山东联创互联网传媒股份有限公司,山东,淄博市,276757.14,37151.99,989,2012-08-01,--,,行业应用软件,互联网广告、化工,网络营销传播服务，组合聚醚多元醇的生产、销售
1723,300344,太空智造,太空智造股份有限公司,北京,北京市,46884.29,-3278.92,418,2012-08-01,--,,耐火材料,太空板销售及安装、软件销售、技术服务,太空板(发泡水泥复合板)系列产品的研发、设计、生产、销售及安装。
1724,300345,红宇新材,湖南红宇耐磨新材料股份有限公司,湖南,长沙市,15114.3,-4989.88,394,2012-08-01,--,,基础件,磨球、磨段、传统衬板、3D喷焊衬板、PIP、军品服务、锤头,提供以核心技术专利产品鉻锰钨抗磨铸铁磨球以及台阶型衬板为依托，向前延伸物料检测、磨球级配技术，向后延伸售后跟踪服务为一体的节能球磨整体技术解决方案。
1725,300346,南大光电,江苏南大光电材料股份有限公司,江苏,苏州市,17721.35,3383.91,217,2012-08-07,--,,半导体材料,光电子元器件,光电新材料MO源的研发、生产和销售
1726,300347,泰格医药,杭州泰格医药科技股份有限公司,浙江,杭州市,168703.35,30101.39,3214,2012-08-17,--,,医疗服务,临床试验技术服务、临床研究相关咨询服务,为医药产品研发提供I至IV期临床试验技术服务、数据管理、统计分析、注册申报、中心检测、医学影像、健康咨询等临床研究服务
1727,300348,长亮科技,深圳市长亮科技股份有限公司,广东,深圳市,87965.23,8768.65,3278,2012-08-17,--,,行业应用软件,软件开发业务、系统集成业务、维护服务业务,提供商业银行IT解决方案与服务，计算机软、硬件的技术开发、技术服务及相应的系统集成。
1728,300349,金卡智能,金卡智能集团股份有限公司,浙江,温州市,168754.54,34814.21,1660,2012-08-17,--,,仪器仪表,仪器仪表行业、天然气、计算应用服务业,为公用事业领域客户提供从智能设备、通讯网络、应用管理软件到互联网云服务的高价值、高性能的产品及端到端解决方案。
1729,300350,华鹏飞,华鹏飞股份有限公司,广东,深圳市,96412.38,5912.52,1611,2012-08-21,--,,物流,物流服务、信息服务,综合物流服务、供应链商品销售服务
1730,300351,永贵电器,浙江永贵电器股份有限公司,浙江,台州市,126857.06,18124.84,2687,2012-09-20,--,,轨道交通设备,轨道交通连接器、新能源电动汽车连接器、通信连接器,从事连接器、端接件及接线装置等产品的研发、生产、销售
1731,300352,北信源,北京北信源软件股份有限公司,北京,北京市,51485.26,9145.2,1288,2012-09-12,--,,行业应用软件,涵盖安全的软件开发、安全可控的解决方案、维护服务以及安全系统集成,信息安全软件产品的研发、生产、销售及技术服务
1732,300353,东土科技,北京东土科技股份有限公司,北京,北京市,82105.2,12660.81,1432,2012-09-27,--,,通信传输设备,网络产品和服务,研发、生产、销售工业级网络产品
1733,300354,东华测试,江苏东华测试技术股份有限公司,江苏,泰州市,12948.86,456.83,494,2012-09-20,--,,仪器仪表,测试仪器、传感器、控制分析软件,结构力学性能测试仪器及配套软件的研发、生产和销售，并提供应用解决方案和技术服务。
1734,300355,蒙草生态,内蒙古蒙草生态环境(集团)股份有限公司,内蒙古,呼和浩特市,557888.8,84398.22,1604,2012-09-27,--,,环保,种业科技、生态修复、创新型生态产品,种业科技、生态修复
1735,300356,光一科技,光一科技股份有限公司,江苏,南京市,54022.42,-39240.42,945,2012-10-09,--,,电气仪表,电力设备、软件开发,智能用电信息采集系统软硬件的研发、生产和销售
1736,300357,我武生物,浙江我武生物科技股份有限公司,浙江,湖州市,38557.68,18610.39,718,2014-01-21,--,,生物医药,变应原制品,研发、生产和销售变应原制品
1737,300358,楚天科技,楚天科技股份有限公司,湖南,长沙市,128041.61,16039.62,2651,2014-01-21,--,,医疗器械,制药装备,制药装备的研发、设计、生产、销售和服务。
1738,300359,全通教育,全通教育集团(广东)股份有限公司,广东,中山市,103111.36,6629.16,2031,2014-01-21,--,,教育信息化服务,软件和信息服务,综合利用移动通信和互联网技术手段，采用与基础运营商合作发展的模式，构建信息化系统平台，为中小学校（幼儿园）及学生家长提供即时、便捷、高效的沟通互动服务，推动家庭教育和学校教育二者间的良性配合，满足家长对于关心子女健康成长、提升教育有效性的需要，同时在统一业务体系下，为学生提供学习辅导、学习资源等产品。
1739,300360,炬华科技,杭州炬华科技股份有限公司,浙江,杭州市,97316.2,15730.8,1041,2014-01-21,--,,电气仪表,电工仪器仪表,能源计量仪表和能耗信息采集系统产品研发、生产与销售
1740,300362,天翔环境,成都天翔环境股份有限公司,四川,成都市,93998.74,6532.59,1278,2014-01-21,--,,环保设备,市政污水处理、油田环保、餐厨及有机废弃物处理设备、环保监测、水电设备,大型节能环保及清洁能源设备的研发、生产和销售。
序号,股票代码,股票简称,公司名称,省份,城市,主营业务收入(201712),净利润(201712),员工人数,上市日期,招股书,公司财报,行业分类,产品类型,主营业务
1741,300363,博腾股份,重庆博腾制药科技股份有限公司,重庆,重庆市,118408.88,10744.99,1784,2014-01-29,--,,化学原料药,医药定制研发生产、多客户产品生产、医药化工商贸,医药定制研发生产服务
1742,300364,中文在线,中文在线数字出版集团股份有限公司,北京,北京市,71677.96,7752.71,799,2015-01-21,--,,平面媒体,数字阅读产品、数字出版运营服务、数字内容增值服务,提供数字阅读产品、数字出版运营服务和数字内容增值服务
1743,300365,恒华科技,北京恒华伟业科技股份有限公司,北京,北京市,85574.75,19223.70,1126,2014-01-23,--,,其他软件服务,软件服务、技术服务、软件销售、硬件销售、建造合同,软件开发和技术服务
1744,300366,创意信息,四川创意信息技术股份有限公司,四川,成都市,160941.69,17267.58,1190,2014-01-27,--,,其他软件服务,电信级数据网络系统解决方案及技术服务,电信级数据网络系统解决方案及技术服务
1745,300367,东方网力,东方网力科技股份有限公司,北京,北京市,185472.29,38470.65,1426,2014-01-29,--,,专用计算机设备,PVG网络视频管理平台、网络硬盘录像机、前端设备、轨道交通信息系统、技术服务,城市视频监控管理平台的研发、制造、销售及提供相关技术服务
1746,300368,汇金股份,河北汇金机电股份有限公司,河北,石家庄市,62137.40,-16550.22,1845,2014-01-23,--,,金融设备,现金处理及办公类设备、智能自助类终端设备、软件产品开发及销售、工业自动化设备及加工制造、运维服务及配件耗材销售,为金融银行业提供软件、硬件整体解决方案
1747,300369,绿盟科技,北京神州绿盟信息安全科技股份有限公司,北京,北京市,125511.07,15236.77,2192,2014-01-29,--,,行业应用软件,信息安全行业,信息安全产品的研发、生产、销售及提供专业安全服务
1748,300370,安控科技,北京安控科技股份有限公司,北京,北京市,176637.10,10625.12,1517,2014-01-23,--,,油气服务、智慧产业、自动化,分自动化业务、油气服务业务、智慧产业业务,以自动化、信息化技术为核心的智慧产业解决方案和产品的研发、生产、销售及运营。
1749,300371,汇中股份,汇中仪表股份有限公司,河北,唐山市,24666.90,6524.11,390,2014-01-23,--,,仪器仪表,仪器仪表,超声热量表、超声水表、超声流量计等产品的开发、生产和销售。
1750,300372,欣泰退,丹东欣泰电气股份有限公司,--,--,--,--,371,2014-01-27,--,,--,--,节能型输变电设备和无功补偿装置等电网性能优化设备的开发、生产及销售
1751,300373,扬杰科技,扬州扬杰电子科技股份有限公司,江苏,扬州市,146950.84,26655.69,1938,2014-01-23,--,,半导体分立器件,电子元器件,分立器件芯片、功率二极管、整流桥等半导体分立器件产品的研发、制造与销售。
1752,300374,恒通科技,北京恒通创新赛木科技股份有限公司,北京,北京市,106659.03,6993.35,479,2015-03-19,,,装修装饰材料,新型建筑材料、再生资源,以无机集料阻燃木塑复合墙板为核心产品的、可循环再利用新型建筑材料的研发、生产、销售及组装。
1753,300375,鹏翎股份,天津鹏翎集团股份有限公司,天津,天津市,114278.68,11925.47,1632,2014-01-27,--,,汽车零部件,非轮胎橡胶制品,汽车用胶管的科研、开发、生产和销售
1754,300376,易事特,易事特集团股份有限公司,广东,东莞市,731758.00,71406.88,1619,2014-01-27,--,,太阳能,智慧城市&大数据、智慧能源、轨道交通,"IDC数据中心(含UPS、高压直流)、光伏发电站(含逆变器)和智能微网(含电力轨道交通、新能源车及充电桩)相关产品的研发、生产、销售,及系统解决方案的提供"
1755,300377,赢时胜,深圳市赢时胜信息技术股份有限公司,广东,深圳市,53701.80,20846.31,1964,2014-01-27,--,,行业应用软件,定制软件开发和销售、服务费、商品销售、供应链业务、保理业务,为金融机构及其高端客户的资产管理和资产托管业务提供整体信息化建设解决方案的应用软件及增值服务
1756,300378,鼎捷软件,鼎捷软件股份有限公司,上海,上海市,121598.05,6110.01,3655,2014-01-27,--,,其他软件服务,自制软件销售、外购软硬件销售、技术服务,以ERP软件为核心的企业管理软件的研发、销售、实施及服务。
1757,300379,东方通,北京东方通科技股份有限公司,北京,北京市,29278.64,-30728.67,484,2014-01-28,--,,基础软件,中间件软件、无线网络优化软件、服务器虚拟化软件,基础软件之中间件的研发、销售和服务
1758,300380,安硕信息,上海安硕信息技术股份有限公司,上海,上海市,51357.10,1266.13,2538,2014-01-28,--,,行业应用软件,信贷风险业务管理咨询、软件开发与服务,提供信贷风险业务管理咨询、软件开发与服务
