序号,股票代码,股票简称,公司名称,省份,城市,主营业务收入(201712),净利润(201712),员工人数,上市日期,招股书,公司财报,行业分类,产品类型,主营业务
854,2388,新亚制程,深圳市新亚电子制程股份有限公司,广东,深圳市,81261.08,6496.21,409,2010-04-13,--,,电子零部件,电子制程、商业保理、租赁及其他,提供电子制程系统解决方案及实施方案涉及的电子制程产品。
855,2389,南洋科技,浙江南洋科技股份有限公司,浙江,台州市,144673.55,18670.4,1934,2010-04-13,--,,电子元件,航空航天产品、电子元器件制品,无人机整机产品和应用服务；电容器专用电子薄膜的制造和销售。
856,2390,信邦制药,贵州信邦制药股份有限公司,贵州,黔南布依族苗族自治州,600247.1,31938.35,5651,2010-04-16,--,,中药生产,药品、医疗器械、医疗服务,中成药的研发、生产和销售
857,2391,长青股份,江苏长青农化股份有限公司,江苏,扬州市,224530.59,22789.82,1915,2010-04-16,--,,农药,除草剂、杀虫剂、杀菌剂、服务业、让售材料,化学农药原药及制剂的生产
858,2392,北京利尔,北京利尔高温材料股份有限公司,北京,北京市,227720.07,16222.05,2027,2010-04-23,--,,耐火材料,耐火材料,"钢铁、有色、石化、建材等工业用耐火材料的生产和销售，并承担高温热工窑炉和装备的耐火材料设计研发、生产配套、施工安装、使用维护与技术服务为一体的""全程在线服务""的整体承包业务。"
859,2393,力生制药,天津力生制药股份有限公司,天津,天津市,102943.34,11681.72,1692,2010-04-23,--,,化学制剂,医药,化学药片剂、硬胶囊剂、滴丸剂、冻干粉针剂、水针剂、原料药等产品的生产销售
860,2394,联发股份,江苏联发纺织股份有限公司,江苏,南通市,400362.1,36028.65,8145,2010-04-23,--,,棉纺,色织布、服装(衬衣)、纱线,专业化生产销售色织布、服装、纺织品的外向型棉纺织
序号,股票代码,股票简称,公司名称,省份,城市,主营业务收入(201712),净利润(201712),员工人数,上市日期,招股书,公司财报,行业分类,产品类型,主营业务
861,2395,双象股份,无锡双象超纤材料股份有限公司,江苏,无锡市,127344.25,1308.95,761,2010-04-29,--,,塑料制品,PVC、PU、超纤、PMMA,超细纤维超真皮革、PU合成革、PVC人造革的生产和销售，经营进料加工和“三来一补”业务
862,2396,星网锐捷,福建星网锐捷通讯股份有限公司,福建,福州市,770513.56,47230.28,8577,2010-06-23,--,,通信终端设备,通信设备,研发、生产和销售企业级网络通讯系统设备及终端设备
863,2397,梦洁股份,湖南梦洁家纺股份有限公司,湖南,长沙市,193392.44,5126.37,3797,2010-04-29,--,,家纺,套件、被芯、枕芯,床上用品系列产品的研发、设计、生产和销售
864,2398,建研集团,厦门市建筑科学研究院集团股份有限公司,福建,厦门市,199765.57,19109.13,1669,2010-05-06,--,,专业工程,技术服务、外加剂新材料,建设综合技术服务、商品混凝土、外加剂新材料、蒸压加气混凝土砌块、特种工程施工等
865,2399,海普瑞,深圳市海普瑞药业集团股份有限公司,广东,深圳市,267020.59,13133.03,1615,2010-05-06,--,,化学原料药,肝素钠原料药,肝素钠原料药的研发生产和销售
866,2400,省广集团,广东省广告集团股份有限公司,广东,广州市,1129519.62,-18410.58,2375,2010-05-06,--,,营销服务,广告行业,品牌管理、自有媒体发布、媒介代理、公关活动和杂志发行等
867,2401,中远海科,中远海运科技股份有限公司,上海,上海市,91700.69,7595.1,682,2010-05-06,--,,其他软件服务,软件和信息技术服务,主要从事智能交通和交通信息化、航运信息化、工业和港航自动化、安防系统等领域的业务
868,2402,和而泰,深圳和而泰智能控制股份有限公司,广东,深圳市,197856.79,17810.37,3372,2010-05-11,--,,电子零部件,智能控制电子,智能控制器的研发、生产和销售，包括智能控制技术的研究、对应的嵌入式软件与算法的开发、技术解决方案的提供、产品设计、生产、物流服务等。
869,2403,爱仕达,浙江爱仕达电器股份有限公司,浙江,台州市,307154.55,17273.89,4431,2010-05-11,--,,小家电,炊具、家电、机器人,生产厨房炊具、厨房小家电、家居用品及机器人本体、机器人应用
870,2404,嘉欣丝绸,浙江嘉欣丝绸股份有限公司,浙江,嘉兴市,277316.66,11177.69,3237,2010-05-11,--,,丝绸,丝绸,从事丝、绸、服装等产品的研发、生产和销售业务
871,2405,四维图新,北京四维图新科技股份有限公司,北京,北京市,215648.78,26519.96,4762,2010-05-18,--,,行业应用软件,导航电子地图、综合地理信息服务,导航电子地图的开发和销售
872,2406,远东传动,许昌远东传动轴股份有限公司,河南,许昌市,152261.13,18721.18,1523,2010-05-18,--,,汽车零部件,汽车零部件,生产销售汽车和工程机械传动轴
873,2407,多氟多,多氟多化工股份有限公司,河南,焦作市,373584.55,25651.2,5029,2010-05-18,--,,氟化工,氟化盐、锂电池及核心材料、新能源汽车,六氟磷酸锂及电子化学品、锂离子电池、新能源汽车、无机氟化盐
874,2408,齐翔腾达,淄博齐翔腾达化工股份有限公司,山东,淄博市,2222619.7,84961.2,2145,2010-05-18,--,,聚氨酯,甲乙酮类、顺酐化工类、化工其他类、供应链管理,对原料碳四进行深度加工转化成高附加值精细化工产品的研发、生产和销售
875,2409,雅克科技,江苏雅克科技股份有限公司,江苏,无锡市,113292.21,3452.8,766,2010-05-25,--,,其他化学制品,聚氨酯阻燃剂、发泡剂、催化剂、塑料阻燃剂、深冷复合节能保温材料,磷酸酯阻燃剂和其他橡塑助剂的研发、生产和销售。
876,2410,广联达,广联达科技股份有限公司,北京,北京市,233972.76,47224.42,5200,2010-05-25,--,,行业应用软件,工程造价业务、工程施工业务、海外业务,提供工具类软件产品系列、管理类软件产品系列；提供实施服务、技术服务、培训服务
877,2411,必康股份,江苏必康制药股份有限公司,江苏,南通市,536800.58,89262.58,6435,2010-05-25,--,,中药生产,医药生产类、医药商业类、新能源类、新材料类、化工类,医药板块、新能源新材料板块以及药物中间体（医药中间体、农药中间体）板块三大类
878,2412,汉森制药,湖南汉森制药股份有限公司,湖南,益阳市,82993.78,10880.68,2161,2010-05-25,--,,中药生产,中西药制剂、化学合成药,传统中成药制剂、化学药、医用制剂的研发、生产和销售
879,2413,雷科防务,江苏雷科防务科技股份有限公司,江苏,常州市,76718.06,12256.26,1203,2010-05-28,--,,卫星应用,雷达系统、遥感测控、卫星导航、数字系统、模拟仿真、安全存储,雷达系统、遥感测控、卫星导航、数字系统、模拟仿真、安全存储等产品研发、制造和销售。
880,2414,高德红外,武汉高德红外股份有限公司,湖北,武汉市,101645.78,5844.48,2764,2010-07-16,--,,电子零部件,红外热成像仪及综合光电系统、传统弹药及信息化弹药、房屋出租、技术服务,红外热像仪产品的研发、生产和销售，并提供技术服务
序号,股票代码,股票简称,公司名称,省份,城市,主营业务收入(201712),净利润(201712),员工人数,上市日期,招股书,公司财报,行业分类,产品类型,主营业务
881,2415,海康威视,杭州海康威视数字技术股份有限公司,浙江,杭州市,4190547.66,941085.51,26330,2010-05-28,--,,PC、服务器及硬件,视频产品及视频服务,安防产品的研发、生产和销售。
882,2416,爱施德,深圳市爱施德股份有限公司,广东,深圳市,5665990.63,37896.76,2882,2010-05-28,--,,专业连锁,移动通信产品、数码电子产品,国内商业，移动通讯、电子产品及相关配套产品的购销与代理，供应链管理等
883,2417,深南股份,深南金科股份有限公司,福建,福州市,10483.54,767.18,110,2010-06-01,--,,通信配套服务,通讯制造、保理服务、融资租赁,商业保理、融资租赁、大数据业务相关的研究、开发、销售及应用软件等服务
884,2418,康盛股份,浙江康盛股份有限公司,浙江,杭州市,333947.54,19148.86,4455,2010-06-01,--,,制冷配件,新能源汽车部件、制冷管路及配件,"内螺纹钢管、精密铜管、钢管、铝管、冷轧钢带、铜带、冰箱、冷柜、空调金属管路配件的加工、销售,同时经营进出口业务，电机、电控、电空调等产品的研发、生产、销售，融资租赁业务及相关的咨询、担保和商业保理"
885,2419,天虹股份,天虹商场股份有限公司,广东,深圳市,1853628.47,71819.26,15249,2010-06-01,--,,百货,零售、房地产开发,提供服饰、日用品、生鲜、熟食等商品及餐饮、娱乐等服务
886,2420,毅昌股份,广州毅昌科技股份有限公司,广东,广州市,569773.36,-47852.76,5933,2010-06-01,--,,电视机,家电行业、汽车行业,设计、生产和销售电视机结构件、白色家电结构件以及汽车结构件等
887,2421,达实智能,深圳达实智能股份有限公司,广东,深圳市,257248.77,31182.58,2412,2010-06-03,--,,行业应用软件,信息技术服务,建筑智能化及建筑节能服务，同时提供工业自动化系统集成和IC卡读写设备的生产、销售业务
888,2422,科伦药业,四川科伦药业股份有限公司,四川,成都市,1143494.88,74854.42,18289,2010-06-03,--,,化学制剂,医药制造,输液系列药品的开发、生产和销售
889,2423,中原特钢,中原特钢股份有限公司,河南,济源市,97292.59,-25792.04,2404,2010-06-03,--,,基础件,专用设备制造,工业专用装备及大型特殊钢精锻件的研发、生产、销售和服务
890,2424,贵州百灵,贵州百灵企业集团制药股份有限公司,贵州,安顺市,259181.67,52613.74,5456,2010-06-03,--,,中药生产,苗药、非苗药,从事止咳化痰用药、感冒用药、心脑血管用药等中成药的生产与销售
891,2425,凯撒文化,凯撒(中国)文化股份有限公司,广东,汕头市,70387.17,25457.15,604,2010-06-08,--,,游戏,服装业、文化与娱乐业,网络游戏的研发及运营、IP运营、多媒体文化产品设计制作、文学剧本创作、影视策划、投资以及服装、服饰的设计、销售
892,2426,胜利精密,苏州胜利精密制造科技股份有限公司,江苏,苏州市,1591310.85,46225.78,7171,2010-06-08,--,,基础件,精密制造、智能制造、新能源,精密制造、智能制造和新能源
893,2427,*ST尤夫,浙江尤夫高新纤维股份有限公司,浙江,湖州市,511162.74,32752.45,3407,2010-06-08,--,,涤纶,化学纤维制造业、锂电池行业,涤纶工业长丝的研发、生产和销售
894,2428,云南锗业,云南临沧鑫圆锗业股份有限公司,云南,临沧市,46428.25,846.44,1496,2010-06-08,--,,稀有金属,有色金属,从锗矿和含锗褐煤矿中提锗，自有锗矿矿山和含锗褐煤矿山，建有集采、冶、销售于一体的锗生产基地，具有自营出口权。
895,2429,兆驰股份,深圳市兆驰股份有限公司,广东,深圳市,1022867.05,60292.75,8016,2010-06-10,--,,机顶盒,及液晶电视、互联网智能终端及视频服务、机顶盒及网络通信产品、LED产品及配件,家庭视听消费类电子产品研发、设计、生产、销售
896,2430,杭氧股份,杭州杭氧股份有限公司,浙江,杭州市,645179.92,36070.4,3960,2010-06-10,--,,其他专用机械,空分设备、气体销售、乙烯冷箱产品、工程总包,大中型空分设备、石化设备的生产和销售和工业气体的生产和销售
897,2431,棕榈股份,棕榈生态城镇发展股份有限公司,广东,中山市,525325.91,30427.36,1394,2010-06-10,--,,园林工程,园林工程、景观设计、苗木销售、生态城镇,风景园林规划设计、园林工程施工及苗木生产、销售。
898,2432,九安医疗,天津九安医疗电子股份有限公司,天津,天津市,59791.89,-16586.12,1879,2010-06-10,--,,医疗器械,家用医疗健康电子产品、健康管理云平台系统及服务,家用医疗器械的研发、生产及销售
899,2433,太安堂,广东太安堂药业股份有限公司,广东,汕头市,323894.06,29039.86,1698,2010-06-18,--,,中药生产,医药,中成药的研发、生产和销售
900,2434,万里扬,浙江万里扬股份有限公司,浙江,金华市,503019.66,64309.52,4901,2010-06-18,--,,汽车零部件,汽车零部件制造、农业装备零部件制造、融资租赁,研发、生产、销售汽车变速器及其它汽车零部件。
序号,股票代码,股票简称,公司名称,省份,城市,主营业务收入(201712),净利润(201712),员工人数,上市日期,招股书,公司财报,行业分类,产品类型,主营业务
901,2435,长江润发,长江润发医药股份有限公司,江苏,苏州市,298694.76,33469.36,1849,2010-06-18,--,,化学制剂,电梯导轨、医药,医药制造业务及机械制造业务
902,2436,兴森科技,深圳市兴森快捷电路科技股份有限公司,广东,深圳市,328296.48,16474.87,4920,2010-06-18,--,,印制电路板,PCB、军品、半导体,印制线路样板及小批量板的研发、生产、销售
903,2437,誉衡药业,哈尔滨誉衡药业股份有限公司,黑龙江,哈尔滨市,304188.35,30967.57,2640,2010-06-23,--,,化学制剂,心脑血管药物、骨科药物、营养类药物、抗感染药物、推广服务、电解质类药物、免疫增强药物、抗肿瘤药物,从事药品生产、销售
904,2438,江苏神通,江苏神通阀门股份有限公司,江苏,南通市,75566.14,6239.96,1260,2010-06-23,--,,基础件,冶金、核电、能源装备、节能服务,生产销售阀门及冶金、电力、化工机械、比例伺服阀
905,2439,启明星辰,启明星辰信息技术集团股份有限公司,北京,北京市,227852.53,45189.2,3781,2010-06-23,--,,其他软件服务,安全产品、安全服务、硬件,专注于信息安全领域，已经形成安全产品和安全服务两条业务主线，可以较为完备地覆盖客户的网络安全需求。
906,2440,闰土股份,浙江闰土股份有限公司,浙江,绍兴市,605698.35,93485.09,5626,2010-07-06,--,,印染化学品,专用化学产品,从事纺织染料、印染助剂和化工原料的研发、生产和销售
907,2441,众业达,众业达电气股份有限公司,广东,汕头市,760108.73,20062.3,2640,2010-07-06,--,,其他电气设备,能源、材料和机械电子设备批发业、电气机械及器材制造业,"通过自有的销售网络分销签约供应商的工业电气元器件产品,以及进行系统集成产品和成套制造产品的生产和销售。"
908,2442,龙星化工,龙星化工股份有限公司,河北,邢台市,270224.75,4995.9,1525,2010-07-06,--,,其他化学制品,橡胶用炭黑、白炭黑、工业萘、电力,橡胶用炭黑、白炭黑及工业萘等煤焦油加工业务
909,2443,金洲管道,浙江金洲管道科技股份有限公司,浙江,湖州市,386294.77,16265.16,1864,2010-07-06,--,,特钢,焊接钢管,高等级石油天然气输送用螺旋焊管、镀锌钢管、钢塑复合管的研发、制造和销售
910,2444,巨星科技,杭州巨星科技股份有限公司,浙江,杭州市,428061.01,54982.31,4862,2010-07-13,--,,金属制品,手工具、手持式电动工具、智能产品,五金工具的生产销售及进出口业务
911,2445,中南文化,中南红文化集团股份有限公司,江苏,无锡市,152530.28,29285.95,980,2010-07-13,--,,影视,文化传媒、金属制造,管件、法兰、管系和压力容器的研发、生产和销售
912,2446,盛路通信,广东盛路通信科技股份有限公司,广东,佛山市,95815.07,10077.74,2246,2010-07-13,--,,通信传输设备,通信设备、汽车电子、军工电子,通信设备的生产和销售，提供通讯工程建设劳务。
913,2447,晨鑫科技,大连晨鑫网络科技股份有限公司,辽宁,大连市,39188.58,27137.35,112,2010-07-13,--,,海洋渔业,围堰海参、海参加工品,移动游戏业务。
914,2448,中原内配,中原内配集团股份有限公司,河南,焦作市,150414.7,27922.97,4110,2010-07-16,--,,汽车零部件,气缸套,内燃机气缸套的研制、开发、制造、销售及技术服务
915,2449,国星光电,佛山市国星光电股份有限公司,广东,佛山市,347260.24,35913.39,5059,2010-07-16,--,,LED,半导体发光二极管(LED)及其应用产品,从事SMDLED器件及组件的的研发、生产和销售
916,2450,康得新,康得新复合材料集团股份有限公司,江苏,苏州市,1178907.35,247438.18,4081,2010-07-16,--,,化学新材料,制造业,从事先进高分子材料的研发、生产和销售
917,2451,摩恩电气,上海摩恩电气股份有限公司,上海,上海市,46746.85,5922.62,158,2010-07-20,--,,电线电缆,电缆、类金融,电线电缆、风电塔筒和租赁保理
918,2452,长高集团,湖南长高高压开关集团股份公司,湖南,长沙市,141571.46,6089.75,1605,2010-07-20,--,,其他输变电设备,高压隔离开关及接地开关、断路器及组合电器、成套、电气二次设备、房产、耐磨材料、机电设备、电动车高压配电箱总成、新能源汽车出租、服务、工程施工、设计、房屋租赁,高压隔离开关及接地开关的生产和销售
919,2453,华软科技,金陵华软科技股份有限公司,江苏,苏州市,147266.07,1566.59,1485,2010-07-20,--,,其他化学制品,精细化工产品 、精细化工产品、供应链管理,金融科技和供应链管理
920,2454,松芝股份,上海加冷松芝汽车空调股份有限公司,上海,上海市,417246.22,36610.39,3886,2010-07-20,--,,汽车零部件,车辆空调及零配件,专业从事移动式空调系统研发、生产及销售。
序号,股票代码,股票简称,公司名称,省份,城市,主营业务收入(201712),净利润(201712),员工人数,上市日期,招股书,公司财报,行业分类,产品类型,主营业务
921,2455,百川股份,江苏百川高科新材料股份有限公司,江苏,无锡市,246450.78,10457.46,813,2010-08-03,--,,其他化学制品,化工行业,醋酸丁酯和偏苯三酸酐的生产和销售
922,2456,欧菲科技,欧菲科技股份有限公司,广东,深圳市,3379103.14,82252.14,41826,2010-08-03,--,,光学元件,微摄像头模组、触摸屏和触控显示全贴合模组、指纹识别模组、智能汽车电子产品和服务,触控显示类业务、摄像通讯类业务和生物识别类业务
923,2457,青龙管业,宁夏青龙管业股份有限公司,宁夏,吴忠市,118556.43,1926.76,1623,2010-08-03,--,,管材,主流供排水管道产品、节水灌溉产品、燃气管道、新型节能供热管道及上述产品配套管件,各类供水、排水管道的研发、制造和销售
924,2458,益生股份,山东益生种畜禽股份有限公司,山东,烟台市,65640.49,-31036.82,3220,2010-08-10,--,,畜牧养殖,父母代肉种雏鸡、父母代蛋种雏鸡、商品肉雏鸡、种猪、商品猪、生物肥料以及乳品,祖代种鸡的引进与饲养、父母代种雏鸡的生产与销售、商品肉雏鸡的生产与销售、饲料的生产、种猪和商品猪的饲养和销售、奶牛的饲养与牛奶销售。
925,2459,天业通联,秦皇岛天业通联重工股份有限公司,河北,秦皇岛市,35691.23,2216.8,708,2010-08-10,--,,工程机械,架桥机、运架一体机、运梁车、提梁机、模具,铁路桥梁施工起重运输设备的制造和销售
926,2460,赣锋锂业,江西赣锋锂业股份有限公司,江西,新余市,438344.61,146907.81,3327,2010-08-10,--,,稀有金属,锂化合物、金属锂、锂电池、锂电池回收,各种深加工锂产品的研究、开发、生产与销售
927,2461,珠江啤酒,广州珠江啤酒股份有限公司,广东,广州市,376360.83,18536.39,4197,2010-08-18,--,,啤酒,啤酒销售、酵母饲料销售、包装材料、租赁餐饮服务等,啤酒的制造、加工、销售
928,2462,嘉事堂,嘉事堂药业股份有限公司,北京,北京市,1423889.97,26364.16,2587,2010-08-18,--,,医药商业,医药批发、医药连锁、医药物流,医药批发、连锁零售业务，2005年公司开始经营与医药批发、零售相关的医药物流业务，在满足公司自身医药批发、零售需求的基础上，开展第三方医药物流配送业务。
929,2463,沪电股份,沪士电子股份有限公司,江苏,苏州市,462674.43,20351.77,7580,2010-08-18,--,,印制电路板,PCB,从事单、双面及多层电路板、高密度互连积层板(HDI)、电路板组装产品、电子设备使用的连接线和连接器等产品及同类和相关产品的批发、进出口业务。
930,2464,众应互联,众应互联科技股份有限公司,江苏,苏州市,50492.8,19222.46,116,2010-08-31,--,,电子商务B2B,游戏授权/注册码、游戏虚拟物品、返利收入、全球移动大数据流量分发、移动游戏运营服务、商品销售,为正版授权/注册码及游戏虚拟物品提供相关交易服务
931,2465,海格通信,广州海格通信集团股份有限公司,广东,广州市,335207.07,29328.42,9367,2010-08-31,--,,通信传输设备,无线通信、北斗导航、泛航空、软件与信息服务,通信设备、导航设备的研制、生产、销售和服务
932,2466,天齐锂业,天齐锂业股份有限公司,四川,遂宁市,547003.99,214503.88,1384,2010-08-31,--,,锂,锂化合物及衍生品,锂精矿及锂化工产品的生产、加工和销售。
933,2467,二六三,二六三网络通信股份有限公司,北京,北京市,83585.17,3098.69,1120,2010-09-08,--,,通信运营,虚拟运营通信服务,增值通信服务、企业通信服务、海外互联网综合服务业务及其他
934,2468,申通快递,申通快递股份有限公司,浙江,台州市,1265724.14,148783.62,14117,2010-09-08,--,,物流,快递服务、物料销售,快递服务业
935,2469,三维工程,山东三维石化工程股份有限公司,山东,淄博市,75405.17,5726.27,460,2010-09-08,--,,专业工程,工程咨询、工程设计、工程总承包、催化剂,工程设计及工程总承包;催化剂的生产及销售
936,2470,金正大,金正大生态工程集团股份有限公司,山东,临沂市,1983354.01,71549.94,8519,2010-09-08,--,,复合肥,肥料,研发、生产、销售各类农用肥料、原材料及提供相关许可范围内的资讯服务。
937,2471,中超控股,江苏中超控股股份有限公司,江苏,无锡市,741474.07,8371.84,3627,2010-09-10,--,,电线电缆,电力电缆、电气装备用电线电缆、裸电线、电缆材料、电缆接头、电磁线、金属材料、紫砂壶及其配件,电力电缆、电气装备用电线电缆、裸电线、电缆材料、电缆接头、电磁线的生产和销售，以及紫砂壶及其配件、金属材料的销售。
938,2472,双环传动,浙江双环传动机械股份有限公司,浙江,台州市,263894.7,24260.11,4511,2010-09-10,--,,汽车零部件,乘用车齿轮、工程机械齿轮、商用车齿轮、钢材销售,齿轮产品的生产与销售
939,2473,*ST圣莱,宁波圣莱达电器股份有限公司,浙江,宁波市,11733.78,-5689.83,382,2010-09-10,--,,小家电,小家电销售、影视文化、软件服务,温控器及电热水壶的研发、生产和销售
940,2474,榕基软件,福建榕基软件股份有限公司,福建,福州市,74200.47,3276.32,1032,2010-09-15,--,,其他软件服务,系统集成、软件产品及服务、软件园租赁,电子政务、质检行业“三电工程”、信息安全、协同管理等软件产品的开发与销售、计算机系统集成及技术支持与服务。
序号,股票代码,股票简称,公司名称,省份,城市,主营业务收入(201712),净利润(201712),员工人数,上市日期,招股书,公司财报,行业分类,产品类型,主营业务
941,2475,立讯精密,立讯精密工业股份有限公司,广东,深圳市,2282609.98,169056.81,54642,2010-09-15,--,,电子零部件,电脑互联产品及精密组件、汽车互联产品及精密组件、通讯互联产品及精密组件、消费性电子,连接器产品研发、生产和销售
942,2476,宝莫股份,山东宝莫生物化工股份有限公司,山东,东营市,40982.85,827.04,530,2010-09-15,--,,其他化学制品,化学原料及化学制品制造业、专业技术服务业、石油和天然气开采业、环保水处理业,油气工程技术服务、油气勘探开发、油田及非油田化学品的研发、生产和销售。
943,2477,雏鹰农牧,雏鹰农牧集团股份有限公司,河南,郑州市,569820.44,4518.88,3552,2010-09-15,--,,畜牧养殖,畜牧养殖业、批发零售业、生猪屠宰业、种植业,畜养殖与销售、家畜屠宰、鲜冻肉熟食以及粮食销售；小规模的对外贷款、担保业务，农牧机械、兽医机械、农业建材的生产及销售等。
944,2478,常宝股份,江苏常宝钢管股份有限公司,江苏,常州市,349440.63,14367.55,3309,2010-09-21,--,,特钢,钢压延及加工、医疗服务,钢管生产销售、医疗服务
945,2479,富春环保,浙江富春江环保热电股份有限公司,浙江,杭州市,332359.46,34444.18,1682,2010-09-21,--,,电力,清洁电能、清洁热能、煤炭、冷轧钢卷、纸制品,发电电力业务;蒸汽、热水生产;热电技术咨询;精密冷轧薄板的生产、销售
946,2480,新筑股份,成都市新筑路桥机械股份有限公司,四川,成都市,166023.24,1245.64,1990,2010-09-21,--,,基础件,机械制造,桥梁功能部件、轨道交通、搅拌设备、路面施工机械、特种汽车、超级电容系统等
